{
  "spec_version": "v1",
  "schema_version": "2.0.0",
  "capsule_id": "0x3f6e8C2A9b1D4f0E3F6e8c2a9B1d4F0e3f6E8c2A/018f4b50-1b8c-7b3e-9b1a-9d7d3f0c5a42",
  "created_at": "2026-02-04T08:00:00Z",
  "tool": {
    "name": "namnesis",
    "version": "2.0.0"
  },
  "artifacts": [
    {
      "path": "MEMORY.md",
      "kind": "memory",
      "mode": "include_plaintext",
      "plaintext_hash": "a3b2c1d0e4f56789a3b2c1d0e4f56789a3b2c1d0e4f56789a3b2c1d0e4f56789",
      "size_bytes": 128,
      "blob_id": "1f2e3d4c5b6a79801f2e3d4c5b6a79801f2e3d4c5b6a79801f2e3d4c5b6a7980"
    }
  ],
  "blobs": [
    {
      "blob_id": "1f2e3d4c5b6a79801f2e3d4c5b6a79801f2e3d4c5b6a79801f2e3d4c5b6a7980",
      "hash": "1f2e3d4c5b6a79801f2e3d4c5b6a79801f2e3d4c5b6a79801f2e3d4c5b6a7980",
      "size_bytes": 128,
      "storage": {
        "backend": "local_dir",
        "ref": "capsules/0x3f6e8C2A9b1D4f0E3F6e8c2a9B1d4F0e3f6E8c2A/018f4b50-1b8c-7b3e-9b1a-9d7d3f0c5a42/blobs/1f2e3d4c5b6a79801f2e3d4c5b6a79801f2e3d4c5b6a79801f2e3d4c5b6a7980"
      }
    }
  ],
  "redaction": {
    "report_path": "redaction.report.json",
    "policy_version": "v1.0.0"
  },
  "signature": {
    "alg": "ecdsa_secp256k1_eip191",
    "payload_alg": "rfc8785_jcs_without_signature_utf8",
    "signer_address": "0x3f6e8C2A9b1D4f0E3F6e8c2a9B1d4F0e3f6E8c2A",
    "sig": "a1b2c3d4e5f6a1b2c3d4e5f6a1b2c3d4e5f6a1b2c3d4e5f6a1b2c3d4e5f6a1b2c3d4e5f6a1b2c3d4e5f6a1b2c3d4e5f6a1b2c3d4e5f6a1b2c3d4e5f6a1b2c3d4e5"
  }
}
