{
  "spec_version": "v1",
  "schema_version": "2.0.0",
  "capsule_id": "0x7C6d5e4F3a2b19087c6D5e4f3A2b19087C6d5E4F/018f4b50-1b8c-7b3e-9b1a-9d7d3f0c5a77",
  "created_at": "2026-02-04T14:00:00Z",
  "tool": {
    "name": "namnesis",
    "version": "2.0.0"
  },
  "artifacts": [
    {
      "path": "MEMORY.md",
      "kind": "memory",
      "mode": "include_plaintext",
      "plaintext_hash": "aaaaaaaaaaaaaaaaaaaaaaaaaaaaaaaaaaaaaaaaaaaaaaaaaaaaaaaaaaaaaaaa",
      "size_bytes": 350,
      "blob_id": "aaaaaaaaaaaaaaaaaaaaaaaaaaaaaaaaaaaaaaaaaaaaaaaaaaaaaaaaaaaaaaaa"
    },
    {
      "path": "config/settings.json",
      "kind": "other",
      "mode": "include_redacted",
      "plaintext_hash": "bbbbbbbbbbbbbbbbbbbbbbbbbbbbbbbbbbbbbbbbbbbbbbbbbbbbbbbbbbbbbbbb",
      "size_bytes": 400,
      "blob_id": "bbbbbbbbbbbbbbbbbbbbbbbbbbbbbbbbbbbbbbbbbbbbbbbbbbbbbbbbbbbbbbbb"
    },
    {
      "path": "SOUL.md",
      "kind": "persona",
      "mode": "include_plaintext",
      "plaintext_hash": "cccccccccccccccccccccccccccccccccccccccccccccccccccccccccccccccc",
      "size_bytes": 920,
      "blob_id": "cccccccccccccccccccccccccccccccccccccccccccccccccccccccccccccccc"
    }
  ],
  "blobs": [
    {
      "blob_id": "aaaaaaaaaaaaaaaaaaaaaaaaaaaaaaaaaaaaaaaaaaaaaaaaaaaaaaaaaaaaaaaa",
      "hash": "aaaaaaaaaaaaaaaaaaaaaaaaaaaaaaaaaaaaaaaaaaaaaaaaaaaaaaaaaaaaaaaa",
      "size_bytes": 350,
      "storage": {
        "backend": "local_dir",
        "ref": "capsules/0x7C6d5e4F3a2b19087c6D5e4f3A2b19087C6d5E4F/018f4b50-1b8c-7b3e-9b1a-9d7d3f0c5a77/blobs/aaaaaaaaaaaaaaaaaaaaaaaaaaaaaaaaaaaaaaaaaaaaaaaaaaaaaaaaaaaaaaaa"
      }
    },
    {
      "blob_id": "bbbbbbbbbbbbbbbbbbbbbbbbbbbbbbbbbbbbbbbbbbbbbbbbbbbbbbbbbbbbbbbb",
      "hash": "bbbbbbbbbbbbbbbbbbbbbbbbbbbbbbbbbbbbbbbbbbbbbbbbbbbbbbbbbbbbbbbb",
      "size_bytes": 400,
      "storage": {
        "backend": "local_dir",
        "ref": "capsules/0x7C6d5e4F3a2b19087c6D5e4f3A2b19087C6d5E4F/018f4b50-1b8c-7b3e-9b1a-9d7d3f0c5a77/blobs/bbbbbbbbbbbbbbbbbbbbbbbbbbbbbbbbbbbbbbbbbbbbbbbbbbbbbbbbbbbbbbbb"
      }
    },
    {
      "blob_id": "cccccccccccccccccccccccccccccccccccccccccccccccccccccccccccccccc",
      "hash": "cccccccccccccccccccccccccccccccccccccccccccccccccccccccccccccccc",
      "size_bytes": 920,
      "storage": {
        "backend": "local_dir",
        "ref": "capsules/0x7C6d5e4F3a2b19087c6D5e4f3A2b19087C6d5E4F/018f4b50-1b8c-7b3e-9b1a-9d7d3f0c5a77/blobs/cccccccccccccccccccccccccccccccccccccccccccccccccccccccccccccccc"
      }
    }
  ],
  "redaction": {
    "report_path": "redaction.report.json",
    "policy_version": "v1.0.0"
  },
  "signature": {
    "alg": "ecdsa_secp256k1_eip191",
    "payload_alg": "rfc8785_jcs_without_signature_utf8",
    "signer_address": "0x7C6d5e4F3a2b19087c6D5e4f3A2b19087C6d5E4F",
    "sig": "c3d4e5f6a1b2c3d4e5f6a1b2c3d4e5f6a1b2c3d4e5f6a1b2c3d4e5f6a1b2c3d4e5f6a1b2c3d4e5f6a1b2c3d4e5f6a1b2c3d4e5f6a1b2c3d4e5f6a1b2c3d4e5"
  }
}
