{
  "spec_version": "v1",
  "schema_version": "2.0.0",
  "capsule_id": "0x5A4b3C2d1e0F98765a4B3c2D1e0f98765a4B3c2D/018f4b50-1b8c-7b3e-9b1a-9d7d3f0c5a55",
  "created_at": "2026-02-04T12:30:00Z",
  "tool": {
    "name": "namnesis",
    "version": "2.0.0"
  },
  "artifacts": [
    {
      "path": "MEMORY.md",
      "kind": "memory",
      "mode": "include_plaintext",
      "plaintext_hash": "0a1b2c3d4e5f60710a1b2c3d4e5f60710a1b2c3d4e5f60710a1b2c3d4e5f6071",
      "size_bytes": 512,
      "blob_id": "0a1b2c3d4e5f60710a1b2c3d4e5f60710a1b2c3d4e5f60710a1b2c3d4e5f6071"
    },
    {
      "path": "memory/2026-02-session.md",
      "kind": "memory",
      "mode": "include_plaintext",
      "plaintext_hash": "1122334455667788112233445566778811223344556677881122334455667788",
      "size_bytes": 1024,
      "blob_id": "1122334455667788112233445566778811223344556677881122334455667788"
    },
    {
      "path": "SOUL.md",
      "kind": "persona",
      "mode": "include_plaintext",
      "plaintext_hash": "deadbeef00112233deadbeef00112233deadbeef00112233deadbeef00112233",
      "size_bytes": 980,
      "blob_id": "deadbeef00112233deadbeef00112233deadbeef00112233deadbeef00112233"
    },
    {
      "path": "AGENTS.md",
      "kind": "ops",
      "mode": "include_plaintext",
      "plaintext_hash": "cafebabedeadbeefcafebabedeadbeefcafebabedeadbeefcafebabedeadbeef",
      "size_bytes": 256,
      "blob_id": "cafebabedeadbeefcafebabedeadbeefcafebabedeadbeefcafebabedeadbeef"
    },
    {
      "path": "projects/demo/STATUS.md",
      "kind": "project",
      "mode": "include_plaintext",
      "plaintext_hash": "0123456789abcdef0123456789abcdef0123456789abcdef0123456789abcdef",
      "size_bytes": 144,
      "blob_id": "0123456789abcdef0123456789abcdef0123456789abcdef0123456789abcdef"
    }
  ],
  "blobs": [
    {
      "blob_id": "0a1b2c3d4e5f60710a1b2c3d4e5f60710a1b2c3d4e5f60710a1b2c3d4e5f6071",
      "hash": "0a1b2c3d4e5f60710a1b2c3d4e5f60710a1b2c3d4e5f60710a1b2c3d4e5f6071",
      "size_bytes": 512,
      "storage": {
        "backend": "local_dir",
        "ref": "capsules/0x5A4b3C2d1e0F98765a4B3c2D1e0f98765a4B3c2D/018f4b50-1b8c-7b3e-9b1a-9d7d3f0c5a55/blobs/0a1b2c3d4e5f60710a1b2c3d4e5f60710a1b2c3d4e5f60710a1b2c3d4e5f6071"
      }
    },
    {
      "blob_id": "1122334455667788112233445566778811223344556677881122334455667788",
      "hash": "1122334455667788112233445566778811223344556677881122334455667788",
      "size_bytes": 1024,
      "storage": {
        "backend": "local_dir",
        "ref": "capsules/0x5A4b3C2d1e0F98765a4B3c2D1e0f98765a4B3c2D/018f4b50-1b8c-7b3e-9b1a-9d7d3f0c5a55/blobs/1122334455667788112233445566778811223344556677881122334455667788"
      }
    },
    {
      "blob_id": "deadbeef00112233deadbeef00112233deadbeef00112233deadbeef00112233",
      "hash": "deadbeef00112233deadbeef00112233deadbeef00112233deadbeef00112233",
      "size_bytes": 980,
      "storage": {
        "backend": "local_dir",
        "ref": "capsules/0x5A4b3C2d1e0F98765a4B3c2D1e0f98765a4B3c2D/018f4b50-1b8c-7b3e-9b1a-9d7d3f0c5a55/blobs/deadbeef00112233deadbeef00112233deadbeef00112233deadbeef00112233"
      }
    },
    {
      "blob_id": "cafebabedeadbeefcafebabedeadbeefcafebabedeadbeefcafebabedeadbeef",
      "hash": "cafebabedeadbeefcafebabedeadbeefcafebabedeadbeefcafebabedeadbeef",
      "size_bytes": 256,
      "storage": {
        "backend": "local_dir",
        "ref": "capsules/0x5A4b3C2d1e0F98765a4B3c2D1e0f98765a4B3c2D/018f4b50-1b8c-7b3e-9b1a-9d7d3f0c5a55/blobs/cafebabedeadbeefcafebabedeadbeefcafebabedeadbeefcafebabedeadbeef"
      }
    },
    {
      "blob_id": "0123456789abcdef0123456789abcdef0123456789abcdef0123456789abcdef",
      "hash": "0123456789abcdef0123456789abcdef0123456789abcdef0123456789abcdef",
      "size_bytes": 144,
      "storage": {
        "backend": "local_dir",
        "ref": "capsules/0x5A4b3C2d1e0F98765a4B3c2D1e0f98765a4B3c2D/018f4b50-1b8c-7b3e-9b1a-9d7d3f0c5a55/blobs/0123456789abcdef0123456789abcdef0123456789abcdef0123456789abcdef"
      }
    }
  ],
  "redaction": {
    "report_path": "redaction.report.json",
    "policy_version": "v1.0.0"
  },
  "signature": {
    "alg": "ecdsa_secp256k1_eip191",
    "payload_alg": "rfc8785_jcs_without_signature_utf8",
    "signer_address": "0x5A4b3C2d1e0F98765a4B3c2D1e0f98765a4B3c2D",
    "sig": "b2c3d4e5f6a1b2c3d4e5f6a1b2c3d4e5f6a1b2c3d4e5f6a1b2c3d4e5f6a1b2c3d4e5f6a1b2c3d4e5f6a1b2c3d4e5f6a1b2c3d4e5f6a1b2c3d4e5f6a1b2c3d4"
  }
}
